{
  "design": {
    "burnInSteps": 180,
    "conditions": [
      "scarcity_mutable",
      "neutral_bottleneck_mutable"
    ],
    "intervalDecomposition": "Delta_mu_t = W_t + B_t using the symmetric lineage decomposition on every adjacent recorded snapshot",
    "postShockSteps": 160,
    "primaryCriteria": {
      "deterministicReplayMatchesRUL021": "replayed post-shock deltas match source within 1e-12 and all final populations match",
      "exactIntervalDecomposition": "maximum interval reconstruction error <= 1e-9",
      "scarcityCumulativeTransportMostlyReweighting": "median cumulative scarcity reweighting path share >= 0.60",
      "scarcityExceedsNeutralTemporalTurnover": "median paired scarcity-minus-neutral cumulative lineage total-variation turnover >= +0.10",
      "scarcityReweightingPathIsNontrivial": "median scarcity cumulative reweighting path / norm(net reweighting vector) >= 1.50",
      "scarcityShowsSequentialDominance": "at least half of scarcity seeds change dominant founder lineage at least once post-shock"
    },
    "recordEvery": 5,
    "ruleDimensions": [
      "forage_weight",
      "hazard_avoidance",
      "exploration",
      "reproduction_threshold"
    ],
    "seedCount": 12,
    "seeds": [
      14003,
      14011,
      14029,
      14041,
      14057,
      14071,
      14087,
      14101,
      14119,
      14137,
      14153,
      14173
    ]
  },
  "experimentId": "RUL-026",
  "interpretationBoundary": "RUL-026 is a time-resolved descriptive transport analysis of founder-lineage mass in the engineered ALife system. Sequential dominance, turnover, and path tortuosity do not by themselves establish adaptive selection, and scarcity-specific claims require comparison with the matched neutral bottleneck.",
  "observerId": "OBSERVER-ALIFE-LINEAGE-TRANSPORT",
  "primaryTest": {
    "criteria": {
      "deterministicReplayMatchesRUL021": true,
      "exactIntervalDecomposition": true,
      "scarcityCumulativeTransportMostlyReweighting": true,
      "scarcityExceedsNeutralTemporalTurnover": true,
      "scarcityReweightingPathIsNontrivial": true,
      "scarcityShowsSequentialDominance": true
    },
    "criteriaPassed": 6,
    "criteriaTotal": 6,
    "pilotSupported": true
  },
  "results": {
    "allReplayFinalPopulationsMatch": true,
    "maxReplayPostShockDeltaAbsError": 0.0,
    "medianScarcityMinusNeutralCumulativeTurnover": 0.2013630627815135,
    "neutral": {
      "maxIntervalDecompositionError": 2.98775589569075e-16,
      "medianCentroidPathTortuosity": 3.6995888872352465,
      "medianCentroidStepReversalFraction": 0.5694444444444444,
      "medianCumulativeLineageTurnoverTV": 1.77937749399202,
      "medianCumulativeReweightingShare": 0.7259651565703208,
      "medianDominantLineageSwitchCount": 4.0,
      "medianReweightingPathTortuosity": 4.09554009588285,
      "medianTransientSweepCount": 0.0,
      "medianUniqueDominantLineageCount": 3.0,
      "runCount": 12,
      "runsWithDominantLineageSwitch": 10,
      "runsWithTransientSweep": 0
    },
    "scarcity": {
      "maxIntervalDecompositionError": 3.4882826242443e-16,
      "medianCentroidPathTortuosity": 3.6729718502274826,
      "medianCentroidStepReversalFraction": 0.445,
      "medianCumulativeLineageTurnoverTV": 1.9509647765593199,
      "medianCumulativeReweightingShare": 0.8393459692862477,
      "medianDominantLineageSwitchCount": 3.0,
      "medianReweightingPathTortuosity": 4.117193157270394,
      "medianTransientSweepCount": 0.0,
      "medianUniqueDominantLineageCount": 3.0,
      "runCount": 12,
      "runsWithDominantLineageSwitch": 11,
      "runsWithTransientSweep": 0
    }
  },
  "ruleSpaceId": "RSPACE-ALIFE-001",
  "runs": [
    {
      "centroidPathTortuosity": 2.648347071872742,
      "centroidStepReversalFraction": 0.2857142857142857,
      "condition": "scarcity_mutable",
      "cumulativeCentroidPath": 0.36786133869742826,
      "cumulativeLineageTurnoverTV": 2.437736448268873,
      "cumulativeReweightingPath": 0.36591902934816306,
      "cumulativeReweightingShare": 0.8576762962729556,
      "cumulativeWithinLineagePath": 0.06072098733210352,
      "dominantLineageSwitchCount": 3,
      "intervalCount": 33,
      "maxIntervalDecompositionError": 3.4882826242443e-16,
      "reweightingPathTortuosity": 2.956102881557156,
      "seed": 14003,
      "snapshotCount": 34,
      "transientSweepCount": 0,
      "uniqueDominantLineageCount": 3
    },
    {
      "centroidPathTortuosity": 4.532645897119926,
      "centroidStepReversalFraction": 1.0,
      "condition": "neutral_bottleneck_mutable",
      "cumulativeCentroidPath": 0.4195600432999012,
      "cumulativeLineageTurnoverTV": 1.9542207792207789,
      "cumulativeReweightingPath": 0.40269904536147777,
      "cumulativeReweightingShare": 0.7568170953000977,
      "cumulativeWithinLineagePath": 0.12939655324784954,
      "dominantLineageSwitchCount": 7,
      "intervalCount": 33,
      "maxIntervalDecompositionError": 1.214925819315949e-16,
      "reweightingPathTortuosity": 6.3018288840332435,
      "seed": 14003,
      "snapshotCount": 34,
      "transientSweepCount": 0,
      "uniqueDominantLineageCount": 3
    },
    {
      "centroidPathTortuosity": 3.103799583455785,
      "centroidStepReversalFraction": 0.5263157894736842,
      "condition": "scarcity_mutable",
      "cumulativeCentroidPath": 0.24446999109021356,
      "cumulativeLineageTurnoverTV": 1.863349185722909,
      "cumulativeReweightingPath": 0.2596822285857477,
      "cumulativeReweightingShare": 0.8023864497731078,
      "cumulativeWithinLineagePath": 0.06395512677983517,
      "dominantLineageSwitchCount": 3,
      "intervalCount": 33,
      "maxIntervalDecompositionError": 2.3780152545710324e-16,
      "reweightingPathTortuosity": 4.366946784360976,
      "seed": 14011,
      "snapshotCount": 34,
      "transientSweepCount": 0,
      "uniqueDominantLineageCount": 3
    },
    {
      "centroidPathTortuosity": 5.524407957837264,
      "centroidStepReversalFraction": 0.6666666666666666,
      "condition": "neutral_bottleneck_mutable",
      "cumulativeCentroidPath": 0.26565496234043007,
      "cumulativeLineageTurnoverTV": 1.7602286602286605,
      "cumulativeReweightingPath": 0.2350675648783384,
      "cumulativeReweightingShare": 0.7271576295501141,
      "cumulativeWithinLineagePath": 0.08820149718702508,
      "dominantLineageSwitchCount": 5,
      "intervalCount": 33,
      "maxIntervalDecompositionError": 2.6044549236726305e-16,
      "reweightingPathTortuosity": 5.346937801740219,
      "seed": 14011,
      "snapshotCount": 34,
      "transientSweepCount": 0,
      "uniqueDominantLineageCount": 3
    },
    {
      "centroidPathTortuosity": 3.7168224300793957,
      "centroidStepReversalFraction": 0.38095238095238093,
      "condition": "scarcity_mutable",
      "cumulativeCentroidPath": 0.35147875132427664,
      "cumulativeLineageTurnoverTV": 2.040415203543708,
      "cumulativeReweightingPath": 0.34388688678079765,
      "cumulativeReweightingShare": 0.8068061435996496,
      "cumulativeWithinLineagePath": 0.08234547338258738,
      "dominantLineageSwitchCount": 1,
      "intervalCount": 33,
      "maxIntervalDecompositionError": 2.225912212740863e-16,
      "reweightingPathTortuosity": 4.263613599890899,
      "seed": 14029,
      "snapshotCount": 34,
      "transientSweepCount": 0,
      "uniqueDominantLineageCount": 2
    },
    {
      "centroidPathTortuosity": 3.3356170788657598,
      "centroidStepReversalFraction": 0.7142857142857143,
      "condition": "neutral_bottleneck_mutable",
      "cumulativeCentroidPath": 0.3148423291372841,
      "cumulativeLineageTurnoverTV": 1.7985263277553794,
      "cumulativeReweightingPath": 0.2849312767907657,
      "cumulativeReweightingShare": 0.7037011133354997,
      "cumulativeWithinLineagePath": 0.1199725543829681,
      "dominantLineageSwitchCount": 10,
      "intervalCount": 33,
      "maxIntervalDecompositionError": 2.0989437219196236e-16,
      "reweightingPathTortuosity": 5.5572376154124825,
      "seed": 14029,
      "snapshotCount": 34,
      "transientSweepCount": 0,
      "uniqueDominantLineageCount": 5
    },
    {
      "centroidPathTortuosity": 4.820301180168298,
      "centroidStepReversalFraction": 0.6875,
      "condition": "scarcity_mutable",
      "cumulativeCentroidPath": 0.2537626677173917,
      "cumulativeLineageTurnoverTV": 1.7115465260234732,
      "cumulativeReweightingPath": 0.2516946374328528,
      "cumulativeReweightingShare": 0.8485241313094687,
      "cumulativeWithinLineagePath": 0.04493173787650919,
      "dominantLineageSwitchCount": 6,
      "intervalCount": 33,
      "maxIntervalDecompositionError": 3.0054803885119506e-16,
      "reweightingPathTortuosity": 5.896604207176838,
      "seed": 14041,
      "snapshotCount": 34,
      "transientSweepCount": 0,
      "uniqueDominantLineageCount": 3
    },
    {
      "centroidPathTortuosity": 3.09099263850416,
      "centroidStepReversalFraction": 0.5555555555555556,
      "condition": "neutral_bottleneck_mutable",
      "cumulativeCentroidPath": 0.28104691307824425,
      "cumulativeLineageTurnoverTV": 1.8522976063494812,
      "cumulativeReweightingPath": 0.26634539593471435,
      "cumulativeReweightingShare": 0.7174718959629884,
      "cumulativeWithinLineagePath": 0.10488224020457503,
      "dominantLineageSwitchCount": 1,
      "intervalCount": 33,
      "maxIntervalDecompositionError": 2.98775589569075e-16,
      "reweightingPathTortuosity": 2.7472547664164018,
      "seed": 14041,
      "snapshotCount": 34,
      "transientSweepCount": 0,
      "uniqueDominantLineageCount": 2
    },
    {
      "centroidPathTortuosity": 4.412678224800672,
      "centroidStepReversalFraction": 0.3157894736842105,
      "condition": "scarcity_mutable",
      "cumulativeCentroidPath": 0.3278379160595899,
      "cumulativeLineageTurnoverTV": 1.9387785678728975,
      "cumulativeReweightingPath": 0.3070323862665756,